id,title,uploadedAt,duration
TO2bKmVhXzQ,من احزن القصص في تاريخ البشريه,2021-06-05,00:03:31
Bqk-L-QSypk,اكلوا لحم الفيل شوف ايش صار لهم!!,2021-09-06,00:05:34
ICyr4RJnaCY,قصة الصحابي (مدمن الخمر!!),2021-09-30,00:08:10
JFWZaVYkzGM,قصة مزارع ترك الدواب تاكل من مزرعته || (ما تتخيل ايش صار!!),2021-10-10,00:07:12
PZjDnR_ErzQ,قصة دلو نزل من السماء,2021-11-04,00:06:55
u0GpICL-LYA,قصة الصحابي (الطفيل ابن عمرو الدوسي) | جعل الله له معجزه,2021-11-12,00:13:47
Ys9QuVrj4AU,مواجهة الصحابة رضي الله عنهم ضد أقوى مقاتلين في التاريخ,2021-11-24,00:19:26
2-D_23bdiIs,قصة نوم النبي عن صلاة الفجر,2021-12-04,00:15:53
Za9X-eDAdAs,الصحابي الذي اراد القصاص من رسول الله,2021-12-24,00:22:48
9Z83IclhEqk,معركة الموحدين ضد سانتا (بابا نويل),2022-01-06,00:18:40
m0Xm0zHBH5w,"قصة ""شاهدرخت"" وقرآبين البشر",2022-01-14,00:15:45
v2A8X32AJV8,(معركة الملائكه ضد الجن) القصه وراء وجود ابليس في السماء,2022-08-13,00:12:11
tOt9vLYU2qE,معجزة لرسول الله,2022-09-02,00:08:22
wY4xfwqGHHw,"جربنا نطبق وصف الملائكة لـ""صوت الوحي من الله""",2022-09-10,00:08:06
9-zl4aZshic,انتفخ جسد (شبيه المسيح الدجال) حتى سد الطريق بعد وفاة رسول الله ﷺ؟,2022-09-19,00:15:56
lzqmbjhOb28,فيديو مهم جدا لكل مسلم يعيش في هذا الزمان |  أنس آكشن,2022-11-19,00:15:24
1BwIKGdHsIA,نظرتك بتتغير عن الكريسماس للابد بعد هذا الفيديو,2022-12-31,00:40:57
D1LtLbyxj94,قائد الجيش حبس الشمس في سماء المعركة | يوشع بن نون,2023-03-11,00:07:11
lIsMVLMJZog,ليش تدرس في المدراس؟ | الحقيقة كاملة,2023-07-16,00:16:41
c1zFep2o0Ss,هذي هي الحقيقة !! | تجارة الاكتئاب,2023-09-27,00:28:40