id,title,uploadedAt,duration
b-xWoGhwGPc,المقدمة,2012-02-19,00:02:46
xq0N9vZsQtw,من المسجون؟ أنا أم هم؟,2012-02-20,00:04:39
nL7UrzudVE8,لا تكن حبشرطيا مع الله,2012-02-23,00:05:45
MwEoj-YRpSM,ابن حبك لله على أسس سليمة,2012-02-24,00:06:24
4_iNjFFBOOA,نعيم لا يوصف!,2012-03-03,00:06:02
Y6nH0WhjQwM,فن حسن الظن بالله,2012-03-04,00:07:27
A2D_NJpkasE,الحمد لله على أنه لم يعطني ما تمنيت!,2012-03-05,00:08:23
i_8o3I5O7bw,كيف تتخلص من الخوف من المجهول؟,2012-03-06,00:06:14
tq65of8UALc,الله يتودد إلينا بالبلاء,2012-03-09,00:08:50
umBFA0toLhE,إن لم تستوقفك هذه الآيات فجدد محبتك,2012-03-12,00:11:24
rFmspdhMHYI,فلنحب الله لأنه الودود...,2012-03-15,00:04:57
1yooHA5Luv0,استعن بالله المعين ولا تخف,2012-03-19,00:07:03
ZvGTQQOQozU,الراحمون يرحمهم الرحمن,2012-03-26,00:11:17
qN52zAaLGFQ,فن إحسان الظن بالله ١٤: لا تكتئب!,2012-04-01,00:09:13
Rn6KFC9aC2E,تحويل المشاعر السلبية إلى قوة دافعة,2012-04-14,00:09:54
3RvyRIcdfs4,في أحداث سوريا ومصر,2012-04-18,00:08:39
Yep11wD6goQ,ماذا أفعل من أجل سوريا؟,2012-04-26,00:11:04
IB5263ZX7S0,لطف الله في البلاء,2012-05-11,00:09:01
w_WS5wYcS7A,إخفاء الله لأخطاء عباده,2012-05-22,00:07:06
J8CRfBYUHN4,يائس، مستوحش، قلق، خائف,2012-06-09,00:08:10
VIF83izCIbk,قصيدة بحب الله أتصبر,2012-08-02,00:05:47
aLBbNubCvkM,حب بلا رجعة,2012-09-01,00:05:46
7K5pFHIt6TE,يا من تشكو القدر!,2012-09-09,00:03:33
sMNYSa0MMBc,لماذا لا نستمتع بالنعم,2012-11-10,00:04:46
GFLHZR2czbE,اذا الشيوخ فُتنوا، ايش حال احنا؟!,2017-09-30,00:09:42
bIf1QnbABUY,تنبيه لاعتقاد خطير، سوء الظن بالله وحسن الظن بمن كفر به سبحانه!!,2018-04-04,00:06:55
-RH1d7vdM-U,ما لنا إلا الله - إنها لحظة,2021-12-27,00:21:08
eWeHajdfBlE,لماذا تحدث للمسلمين كل هذه الابتلاءات؟,2022-01-02,00:07:34
oYc5E29UyQM,لم تهونوا على الله,2023-02-13,00:08:27
I3g18ZBZ7Xs,ليس لك عند الله حقوق، درس من إخواننا المبتلَين بالزلزال,2023-02-15,00:04:44